{
  "$schema": "./host-api.schema.json",
  "schemaVersion": 2,
  "contract": "cross-platform-host",
  "inventoryStatus": "active",
  "runtimeResultSchema": "./runtime-result.schema.json",
  "evidence": [
    {
      "id": "oracle-manifest",
      "path": "test/oracles/manifest.json",
      "sha256": "a4158d4bcee890fd731f6bec0faec1125eb2ab6a0d0cc9ac0feabc47ea97098e"
    },
    {
      "id": "approved-xmf",
      "path": "test/oracles/sources/mts_screen/HS1200P08.xmf_",
      "sha256": "4d63ba22ac5339cfd3068cffa91710e0099481da81d974e2aff0ce7ae39ed53e"
    },
    {
      "id": "authored-image-scalars",
      "path": "test/oracles/sources/mts_screen/HS2003S10.image-scalars.lua.source",
      "sha256": "86b0cdcfdc8b9aba349482d3eb507e18e391093e0c758ba81fa5a65ab53e57cb"
    },
    {
      "id": "approved-common-lua",
      "path": "test/oracles/sources/mts_screen/script.lua",
      "sha256": "dfa28a8eecf55b8fbd67322fd101e37a2ef2671cc3ac938e9be0c682bd0fc8d4"
    },
    {
      "id": "approved-json-lua",
      "path": "test/oracles/sources/mts_screen/json.lua",
      "sha256": "426a06909e126f28971771a978af117de8f99f595f12b9839ad2ed0c86f86019"
    },
    {
      "id": "golden-close",
      "path": "test/oracles/golden/close-cancel-lifecycle.json",
      "sha256": "b9324dcd9f6f2ff475213aec4b629c30f0ac7eb0927b55e87d0f04a11e29b945"
    },
    {
      "id": "golden-empty",
      "path": "test/oracles/golden/empty-open-link.json",
      "sha256": "3b81f20442e85c13dd3e5e22d3d4254a45d106d2fcacc741419904ab8ed6f23f"
    },
    {
      "id": "golden-over",
      "path": "test/oracles/golden/json-products-over-100.json",
      "sha256": "e2ad5d3df978a337fd87fbe851a06e7021a1432fa8482c192cbe6a7ffa708b8b"
    },
    {
      "id": "golden-up-to",
      "path": "test/oracles/golden/json-products-up-to-100.json",
      "sha256": "4b4c188e197a8e6d15db2862c79bda9098fe0116f04317d6083a67c9b9d06435"
    },
    {
      "id": "golden-now",
      "path": "test/oracles/golden/open-link-now.json",
      "sha256": "f1bee268ae36f86c9016be0bac2e142e801ef9adaaff4c172a5a9e4dd24e13d3"
    },
    {
      "id": "golden-error",
      "path": "test/oracles/golden/transaction-error.json",
      "sha256": "db1b1fec55ab1baa112d26a1b8c1941fdd3762a03e06be735cf8d6a4589f2c08"
    },
    {
      "id": "image-runtime-fixture",
      "path": "native/resources/image-runtime.lua",
      "sha256": "a27cc5b30ed20495dbffdead8222dc8450278e248c217e5ed1be6258ca468fe0"
    },
    {
      "id": "image-runtime-golden",
      "path": "native/test/image-runtime-golden.json",
      "sha256": "e1c107a06bfdc56fe61b586bd75c75d2641951d90381484421598840893cb0cf"
    }
  ],
  "limits": {
    "allocatorBytes": 33554432,
    "committedStateBytes": 8388608,
    "configBytes": 4194304,
    "diagnosticBytes": 65536,
    "eventPayloadBytes": 262144,
    "hookInstructions": 10000,
    "hostCallMilliseconds": 50,
    "instructions": 1000000,
    "milliseconds": 500,
    "pendingBytes": 4194304,
    "pendingEvents": 64,
    "stagedBytes": 4194304,
    "stagedCommands": 1024,
    "tokens": 32
  },
  "diagnostics": [
    "CANCELED_CALLBACK",
    "DUPLICATE_CALLBACK",
    "DUPLICATE_CLOSE",
    "EXECUTION_TIMEOUT",
    "HOST_ARGUMENT_ERROR",
    "HOST_LOOKUP_MISS",
    "LATE_CALLBACK",
    "LUA_ERROR",
    "QUEUE_LIMIT",
    "REENTRANT_CALL",
    "RESOURCE_LIMIT",
    "RUNTIME_CLOSED",
    "RUNTIME_CLOSING",
    "RUNTIME_INVALID",
    "STALE_REVISION",
    "WRONG_RUNTIME",
    "WRONG_TRANSACTION"
  ],
  "publicApis": [
    {
      "id": "form-get-open-link-data",
      "kind": "function",
      "name": "Form.GetOpenLinkData",
      "decision": "include",
      "arity": {
        "min": 0,
        "max": 0
      },
      "parameters": [],
      "returns": [
        {
          "type": "string",
          "count": "1"
        }
      ],
      "effects": {
        "mode": "read-only",
        "rollback": "not-applicable",
        "command": "none",
        "lifecycle": "none"
      },
      "diagnostics": [
        "HOST_ARGUMENT_ERROR",
        "RESOURCE_LIMIT"
      ],
      "genericResolution": "runtime-field",
      "evidence": [
        {
          "source": "approved-xmf",
          "locator": "line 33"
        },
        {
          "source": "golden-empty",
          "locator": "events[0].hostCalls"
        }
      ],
      "rationale": "Return the immutable create-time open-link string.",
      "affectedPlatforms": [
        "ios",
        "android"
      ],
      "resolution": "normalize",
      "test": "runtime-host-boundary"
    },
    {
      "id": "form-get-shared-data",
      "kind": "function",
      "name": "Form.GetSharedData",
      "decision": "include",
      "arity": {
        "min": 2,
        "max": 2
      },
      "parameters": [
        {
          "name": "key",
          "type": "string",
          "required": true,
          "coercion": "none",
          "restrictions": [
            "maxBytes=262144"
          ]
        },
        {
          "name": "mode",
          "type": "boolean",
          "required": true,
          "coercion": "none",
          "restrictions": [
            "literal=false"
          ]
        }
      ],
      "returns": [
        {
          "type": "string",
          "count": "1"
        }
      ],
      "effects": {
        "mode": "read-only",
        "rollback": "not-applicable",
        "command": "none",
        "lifecycle": "none"
      },
      "diagnostics": [
        "HOST_ARGUMENT_ERROR",
        "HOST_LOOKUP_MISS",
        "RESOURCE_LIMIT"
      ],
      "genericResolution": "provider-map",
      "evidence": [
        {
          "source": "approved-xmf",
          "locator": "line 54"
        },
        {
          "source": "golden-error",
          "locator": "events[3].hostCalls"
        }
      ],
      "rationale": "Resolve only an injected exact shared-data provider key.",
      "affectedPlatforms": [
        "ios",
        "android"
      ],
      "resolution": "normalize",
      "test": "runtime-host-boundary"
    },
    {
      "id": "form-get-item-code-info",
      "kind": "function",
      "name": "Form.GetItemCodeInfo",
      "decision": "include",
      "arity": {
        "min": 2,
        "max": 3
      },
      "parameters": [
        {
          "name": "code",
          "type": "string",
          "required": true,
          "coercion": "none",
          "restrictions": [
            "maxBytes=262144"
          ]
        },
        {
          "name": "kind",
          "type": "string",
          "required": true,
          "coercion": "none",
          "restrictions": [
            "maxBytes=262144",
            "enum=markettext|exchangecode"
          ]
        },
        {
          "name": "marketLink",
          "type": "string",
          "required": false,
          "coercion": "none",
          "restrictions": [
            "maxBytes=262144"
          ]
        }
      ],
      "returns": [
        {
          "type": "string",
          "count": "1"
        }
      ],
      "effects": {
        "mode": "read-only",
        "rollback": "not-applicable",
        "command": "none",
        "lifecycle": "none"
      },
      "diagnostics": [
        "HOST_ARGUMENT_ERROR",
        "HOST_LOOKUP_MISS",
        "RESOURCE_LIMIT"
      ],
      "genericResolution": "provider-map",
      "evidence": [
        {
          "source": "approved-xmf",
          "locator": "lines 96,106,109"
        },
        {
          "source": "golden-up-to",
          "locator": "item-code host calls"
        }
      ],
      "rationale": "Resolve an exact injected tuple; transaction/code identity remains data.",
      "affectedPlatforms": [
        "ios",
        "android"
      ],
      "resolution": "normalize",
      "test": "runtime-host-boundary"
    },
    {
      "id": "form-message-box-ex",
      "kind": "function",
      "name": "Form.MsgBoxEx",
      "decision": "include",
      "arity": {
        "min": 6,
        "max": 6
      },
      "parameters": [
        {
          "name": "title",
          "type": "string",
          "required": true,
          "coercion": "none",
          "restrictions": [
            "maxBytes=262144"
          ]
        },
        {
          "name": "message",
          "type": "string",
          "required": true,
          "coercion": "none",
          "restrictions": [
            "maxBytes=262144"
          ]
        },
        {
          "name": "key",
          "type": "string",
          "required": true,
          "coercion": "none",
          "restrictions": [
            "maxBytes=262144"
          ]
        },
        {
          "name": "legacySlot",
          "type": "string",
          "required": true,
          "coercion": "none",
          "restrictions": [
            "maxBytes=262144",
            "literal="
          ]
        },
        {
          "name": "confirmLabel",
          "type": "string",
          "required": true,
          "coercion": "none",
          "restrictions": [
            "maxBytes=262144"
          ]
        },
        {
          "name": "mode",
          "type": "number",
          "required": true,
          "coercion": "none",
          "restrictions": [
            "finite",
            "literal=0"
          ]
        }
      ],
      "returns": [
        {
          "type": "none",
          "count": "0"
        }
      ],
      "effects": {
        "mode": "staged",
        "rollback": "discard-on-error",
        "command": "messageBox",
        "lifecycle": "none"
      },
      "diagnostics": [
        "HOST_ARGUMENT_ERROR",
        "RESOURCE_LIMIT"
      ],
      "genericResolution": "shared-helper",
      "evidence": [
        {
          "source": "approved-xmf",
          "locator": "line 117"
        },
        {
          "source": "golden-error",
          "locator": "events[3].commands"
        }
      ],
      "rationale": "Stage the evidenced ordered message-box command without invoking UI.",
      "affectedPlatforms": [